So there is no way for me to plug it in here in the US unless I go by a converter.,negative
Tied to charger for conversations lasting more than 45 minutes.MAJOR PROBLEMS!!,negative
I have to jiggle the plug to get it to line up right to get decent volume.,negative
If you have several dozen or several hundred contacts then imagine the fun of sending each of them one by one.,negative
Needless to say I wasted my money.,negative
What a waste of money and time!.,negative
If the two were seperated by a mere 5+ ft I started to notice excessive static and garbled sound from the headset.,negative
The design is very odd as the ear clip is not very comfortable at all.,negative
I advise EVERYONE DO NOT BE FOOLED!,negative
It clicks into place in a way that makes you wonder how long that mechanism would last.,negative
I went on Motorola's website and followed all directions but could not get it to pair again.,negative
The commercials are the most misleading.,negative
I bought it for my mother and she had a problem with the battery.,negative
I didn't think that the instructions provided were helpful to me.,negative
People couldnt hear me talk and I had to pull out the earphone and talk on the phone.,negative
Doesn't hold charge.,negative
This is a simple little phone to use but the breakage is unacceptible.,negative
It is unusable in a moving car at freeway speed.,negative
I have two more years left in this contract and I hate this phone.,negative
You need at least 3 mins to get to your phone book from the time you first turn on the phone.Battery life is short.,negative
Poor Talk Time Performance.,negative
worthless product.,negative
I was not impressed by this product.,negative
I only hear garbage for audio.,negative
Who in their right mind is gonna buy this battery?.,negative
AFTER ARGUING WITH VERIZON REGARDING THE DROPPED CALLS WE RETURNED THE PHONES AFTER TWO DAYS.,negative
Disappointed with battery.,negative
Not loud enough and doesn't turn on like it should.,negative
VERY DISAPPOINTED.,negative
The buttons for on and off are bad.,negative
Essentially you can forget Microsoft's tech support.,negative
Buy a different phone - but not this.,negative
You have to hold the phone at a particular angle for the other party to hear you clearly.,negative
The one big drawback of the MP3 player is that the buttons on the phone's front cover that let you pause and skip songs lock out after a few seconds.,negative
A week later after I activated it it suddenly died.,negative
Mic Doesn't work.,negative
Even in my BMW 3 series which is fairly quiet I have trouble hearing what the other person is saying.,negative
Do Not Buy for D807...wrongly advertised for D807.,negative
I purchased this and within 2 days it was no longer working!!!!!!!!!,negative
Not a good bargain.,negative
The battery runs down quickly.,negative
This item worked great but it broke after 6 months of use.,negative
The construction of the headsets is poor.,negative
For a product that costs as much as this one does I expect it to work far better and with greater ease than this thing does.,negative
The ear buds only play music in one ear.,negative
Dont waste your money...,negative
If you plan to use this in a car forget about it.,negative
I found this product to be waaay too big.,negative
I'm very disappointed with my decision.,negative
Buyer Beware you could flush money right down the toilet.,negative
I received my supposedly new motorola 375 and apparently there was not a match between the phone and the charger.,negative
That's a huge design flaw (unless I'm not using it correctly which I don't think is the case).,negative
The camera although rated at an impressive 1.3 megapixels renders images that fall well below expectations of such a relatively high resolution.,negative
I purcashed this for the car charger and it does not work.,negative
i got this phone around the end of may and i'm completely unhappy with it.,negative
Could not get strong enough signal.,negative
Bad Quality.,negative
Basically the service was very bad.,negative
it did not work in my cell phone plug i am very up set with the charger!.,negative
The BT headset was such a disapoinment.,negative
Buyer--Be Very Careful!!!!!.,negative
The majority of the Logitech earbud headsets failed.,negative
In my house I was getting dropped coverage upstairs and no coverage in my basement.,negative
What a waste.,negative
During several different 2 minute calls I experienced 5 drops and it was in an area that had 5 bars.,negative
I was not happy with this item.,negative
very disappointed.,negative
The phone takes FOREVER to charge like 2 to 5 hours literally.,negative
What a waste of time!,negative
Its reception is very very poor.,negative
Items stated as included from the description ARE NOT INCLUDED.,negative
After 3 months screen just went black all of a sudden.,negative
I Was Hoping for More.,negative
Audio Quality is poor very poor.,negative
I've bought $5 wired headphones that sound better than these.,negative
All I can do is whine on the Internet so here it goes.The more I use the thing the less I like it.,negative
This is essentially a communications tool that does not communicate.,negative
I still maintain that monkeys shouldn't make headphones we just obviously don't share enough DNA to copy the design over to humans.,negative
Doesn't work at all.. I bougth it for my L7c and its not working.,negative
doesn't last long.,negative
One thing I hate is the mode set button at the side.,negative
Thank you for wasting my money.,negative
How can that be?The audio quality is poor.,negative
I put the latest OS on it (v1.15g) and it now likes to slow to a crawl and lock up every once in a while.,negative
It only recognizes the Phone as its storage device.,negative
If you like a loud buzzing to override all your conversations then this phone is for you!,negative
Don't buy this product.,negative
I've had this bluetoooth headset for some time now and still not comfortable with the way it fits on the ear.,negative
I have this phone and it is a thorn in my side I really abhor it.,negative
I recently had problems where I could not stay connected for more than 10 minutes before being disconnected.,negative
Design Flaw?.,negative
Waste of 13 bucks.,negative
But when I check voice mail at night the keypad backlight turns off a few seconds into the first message and then I'm lost.,negative
The replacement died in a few weeks.,negative
I have had problems wit hit dropping signal and more.,negative
Not impressed.,negative
Bad Choice.,negative
The pleather case doesn't fit.,negative
useless phone simply deaf.,negative
It makes very strange ticking noises before it ends the call.,negative
Battery lasts only a few hours.,negative
We are sending it back.,negative
I did not bother contacting the company for few dollar product but I learned the lesson that I should not have bought this form online anyway.,negative
If you hate earbugs avoid this phone by all means.,negative
I also didn't like the on button it felt like it would crack with use.,negative
WORST PHONE EVER.,negative
Freezes frequently4.,negative
It's kind of embarrassing to use because of how it looks and mostly it's embarrassing how child-like the company is.,negative
All in all I'd expected a better consumer experience from Motorola.,negative
There's a horrible tick sound in the background on all my calls that I have never experienced before.,negative
I'm a bit disappointed.,negative
I have had this phone for over a year now and I will tell you its not that great.,negative
I ordered this for sony Ericsson W810i but I think it only worked once (thats when I first used it).,negative
The battery is completely useless to me.,negative
What a big waste of time.,negative
Don't waste your $$$ on this one.,negative
Do not make the same mistake as me.,negative
Big Disappointment with calendar sync.,negative
the phone was unusable and was not new.,negative
Worst Customer Service Ever.,negative
No additional ear gels provided and no instructions whatsoever.,negative
It defeats the purpose of a bluetooth headset.,negative
Internet is excrutiatingly slow.,negative
This product had a strong rubber/petroleum smell that was unbearable after a while and caused me to return it,negative
poor quality and service.,negative
The cable looks so thin and flimsy it is scary.,negative
Absolutel junk.,negative
THAT one didn't work either.,negative
Returned 8 hours later.,negative
Don't waste your money!.,negative
Not only will it drain your player but may also potentially fry it.,negative
Unreliable - I'm giving up.,negative
Avoid this one if you can.,negative
I wasted my little money with this earpiece.,negative
First of all it doesn't wear well.,negative
I wouldn't recommend buying this product.,negative
Piece of Junk.,negative
Poorly contstruct hinge.,negative
Don't buy it.,negative
DO NOT PURCHASE THIS PHONE.,negative
Customer service was terrible.,negative
Battery life still not long enough in Motorola Razor V3i.,negative
Sending it back.,negative
As many people complained I found this headset's microphone was very weak.,negative
My 5-year old Nokia 2160 from Tracfone holds the charge a lot better than this.,negative
They do not care about the consumer one bit.,negative
The instruction manual is lacking.,negative
The battery is unreliable as well as the service use antena.,negative
It's uncomfortable and the sound quality is quite poor compared with the phone (Razr) or with my previous wired headset (that plugged into an LG).,negative
I want my money back.,negative
I ordered this product first and was unhappy with it immediately.,negative
The Ngage is still lacking in earbuds.,negative
I have 2-3 bars on my cell phone when I am home but you cant not hear anything.,negative
However-the riingtones are not the best and neither are the games.,negative
The plug did not work very well.,negative
AMAZON SUCKS.,negative
Rip off---- Over charge shipping.,negative
1. long lasting battery (you don't have to recharge it as frequentyly as some of the flip phones)2.,negative
Obviously there is a problem with the adhesive.,negative
Very disappointing.,negative
It was an inexpensive piece but I would still have expected better quality.,negative
It is practically useless and did not add any kind of boost to my reception after I bought it.,negative
Was not happy.,negative
A PIECE OF JUNK THAT BROKE AFTER BEING ON MY PHONE FOR 2 DAYS!!!,negative
Worst customer service.,negative
Reception is terrible and full of static.,negative
I was sitting in my vehicle with the cradle on my belt and the headset lost signal.,negative
Were JERKS on the phone.,negative
Their network coverage in Los Angeles is horrible.,negative
Excellent starter wireless headset.,negative
The loudspeaker option is great the bumpers with the lights is very ... appealing.,negative
The only thing that I think could improve is the sound leaks out from the headset.,negative
First off the reception sucks I have never had more than 2 bars ever.,negative
The phone gets EXTREMELY HOT!,negative
Also if your phone is dropped this case is not going to save it specially when dropped face down.,negative
bad fit way too big.,negative
Waste of money.,negative
I'll be drivng along and my headset starts ringing for no reason.,negative
The worst phone I've ever had.... Only had it for a few months.,negative
Not a good item.. It worked for a while then started having problems in my auto reverse tape player.,negative
This is so embarassing and also my ears hurt if I try to push the ear plug into my ear.,negative
This is a VERY average phone with bad battery life that operates on a weak network.,negative
Soyo technology sucks.,negative
Same problem as others have mentioned.,negative
The worst piece of crap ever along with the Verizon customer service.,negative
Poor sound quality.,negative
The picture resolution is far below what other comparably-priced phones are offering today.,negative
Using all earpieces left or right this thing will not stay on my ear.,negative
Still Waiting...... I'm sure this item would work well.. if I ever recieve it!,negative
what a disappointment,negative
don't waste your money and time.,negative
It's so stupid to have to keep buying new chargers car chargers cradles headphones and car kits every time a new phone comes out.,negative
I came over from Verizon because cingulair has nicer cell phones.... the first thing I noticed was the really bad service.,negative
I'll be looking for a new earpiece.,negative
We received a WHITE colored battery that goes DEAD after a couple hoursTHe original used to last a week - but still lasts longer than thereplacement,negative
After a year the battery went completely dead on my headset.,negative
This is the first phone I've had that has been so cheaply made.,negative
Att is not clear sound is very distorted and you have to yell when you talk.,negative
The plastic breaks really easy on this clip.,negative
Don't make the same mistake I did.,negative
Oh and I forgot to also mention the weird color effect it has on your phone.,negative
Also the area where my unit broke).- I'm not too fond of the magnetic strap.,negative
Another note about this phone's appearance is that it really looks rather bland especially in the all black model.,negative
Low Quality.,negative
Warning - Stay away.,negative
I wish I could return the unit and get back my money.,negative
I used to talk on it for 1 - 1 1/2 hours and the battery would be literally drained and dying.,negative
If you don't find it too bad as again the unit comes with one earpad only.I would not recommend this to anyone.,negative
Very Displeased.,negative
I might have gotten a defect but I would not risk buying it again because of the built quality alone.,negative
They made this case too small and is very difficult to install.,negative
Does not fit.,negative
There's really nothing bad I can say about this headset.,negative
I even fully charged it before I went to bed and turned off blue tooth and wi-fi and noticed that it only had 20 % left in the morning.,negative
I've also had problems with the phone reading the memory card in which I always turn it on and then off again.,negative
Not good when wearing a hat or sunglasses.,negative
Horrible phone.,negative
BT50 battery junk!.,negative
Cant get the software to work with my computer.,negative
Disappointed!.,negative
poor voice clarity.,negative
No buyers remorse on this one!.,negative
Very disappointed in AccessoryOne.,negative
I find this inexcusable and so will probably be returning this phone and perhaps changing carriers.,negative
The update procedure is difficult and cumbersome.,negative
Disappointment.. I hate anything that goes in my ear.,negative
Uncomfortable In the Ear Don't use with LG VX9900 (EnV).,negative
The volume switch rocketed out of the unit to a destination unknown.,negative
I'd like to return it.,negative
Verizon's bills however are difficult to understand even though their pricing plans are simple.,negative
A Disappointment.,negative
Its not user friendly.,negative
Unfortunately the ability to actually know you are receiving a call is a rather important feature and this phone is pitiful in that respect.,negative
Then I exchanged for the same phone even that had the same problem.,negative
This results in the phone being either stuck at max volume or mute.,negative
Pretty piece of junk.,negative
Plug was the wrong size.,negative
Save your money.... I've had this item for 11 months now.,negative
Bad Purchase.,negative
Defective crap.,negative
I would have given no star if I was able.,negative
The sound quality for the device is unacceptable.Unless you are in a really quiet area you almost hear nothing.,negative
I would not recommend this item to anyone.,negative
The holster that arrived did not match the photo in the ad.,negative
As an earlier review noted plug in this charger and nothing happens.,negative
You never know if you pushed it hard enough or the right number of times for the function you want or not.,negative
I am not impressed with this and i would not recommend this item to anyone.,negative
My only complaint is the standard sound volume is a little low even when turned up to 5(of 5),negative
REALLY UGLY.,negative
horrible had to switch 3 times.,negative
No real improvement.,negative
They refuse to refund or replace.,negative
Unfortunately it's easy to accidentally activate them with the gentle-touch buttons if you accidentally touch the phone to your face while listening.,negative
So I basically threw my money out the window for nothing.,negative
All it took was one drop from about 6 inches above the kitchen counter and it was cracked.I am not impressed and I am not laughing.,negative
none of the new ones have ever quite worked properly.,negative
I've missed numerous calls because of this reason.,negative
Perhaps my phone is defective but people cannot hear me when I use this.,negative
Don't buy this product.,negative
sucked most of the stuff does not work with my phone.,negative
Worst software ever used.... If I could give this zero stars I would.,negative
Trying to make a call on these is an exercise in frustration.,negative
The case is a flimsy piece of plastic and has no front or side protection whatsoever.,negative
I give Wirefly 1 star.I will contact Cingular/AT&T and inform them of this practice.,negative
It's AGGRAVATING!,negative
None of it works just don't buy it.,negative
Muddy low quality sound and the casing around the wire's insert was poorly super glued and slid off.,negative
Please dont waste your money.,negative
If you are looking for a good quality Motorola Headset keep looking this isn't it.,negative
Yet Plantronincs continues to use the same flawed charger design.,negative
Disapointing Results.,negative
Cumbersome design.,negative
It's A PIECE OF CRAP!,negative
My experience was terrible..... This was my fourth bluetooth headset and while it was much more comfortable than my last Jabra (which I HATED!!!,negative
Worst ever.,negative
I can barely ever hear on it and am constantly saying what?,negative
The battery life is highly unacceptable.,negative
That company is a joke.,negative
Due to this happening on every call I was forced to stop using this headset.,negative
Verizon tech support walked my through a few procedures none of which worked and I ended up having to do a hard re-set wiping out all my data.,negative
Voice Quality Signal Strength Dropped Calls.,negative
It feels poorly constructed the menus are difficult to navigate and the buttons are so recessed that it is difficult to push them.,negative
Also difficult to put on.I'd recommend avoiding this product.,negative
I only used it two days and it wasn't always easy to hear with.,negative
I got the car charger and not even after a week the charger was broken...I went to plug it in and it started smoking.,negative
Sprint - terrible customer service.,negative
What possesed me to get this junk I have no idea...,negative
Piece of trash.,negative
The real killer is the volume and of course it breaking.,negative
Poor Construction.,negative
This is infuriating.,negative
Sprint charges for this service.,negative
It is cheap and it feel and look just as cheap.,negative
It doesn't work in Europe or Asia.,negative
the worst phone from samsung...crap..... this crappy Samsung E715.. is the worst i have ever seeen.,negative
the charger worked for about a week and then completely stopped charging my phone.,negative
Poor product.,negative
However I needed some better instructions.,negative
You need two hands to operate the screen.This software interface is decade old and cannot compete with new software designs.,negative
Steer clear of this product and go with the genuine Palm replacementr pens which come in a three-pack.,negative
DO NOT BUY DO NOT BUYIT SUCKS,negative
Plus I seriously do not believe it is worth its steep price point.,negative
Very Dissapointing Performance.,negative
Don't make the same mistake that I did and please don't buy this phone.,negative
This phone might well be the worst I've ever had in any brand.,negative
Case was more or less an extra that I originally put on but later discarded because it scratched my ear.,negative
Don't bother - go to the store.,negative
You get what you pay for I guess.,negative
However BT headsets are currently not good for real time games like first-person shooters since the audio delay messes me up.,negative
Disappointing accessory from a good manufacturer.,negative
Performed awful -- muffled tinny incoming sound and severe echo for those on the other end of the call.,negative
Obviously they have a terrible customer service so you get what you pay for.,negative
I contacted the company and they told me that although the unit was still under warranty if I couldn't produce my receipt I was out of luck.,negative
Linksys should have some way to exchange a bad phone for a refurb unit or something!,negative
When I placed my treo into the case not only was it NOT snug but there was A LOT of extra room on the sides.,negative
Battery is terrible.,negative
The earpiece on this is too large or too heavy...it keeps falling out of my ear.,negative
Utter crap.. Sound quality is TERRIBLE.,negative
The charger arrived within the promised timeframe but it did not work.,negative
Finally after three or four times the spring of the latch broke and I could not use it any longer on the visor.,negative
Talk about USELESS customer service.,negative
It felt too light and tinny..,negative
This does not fit the Palm Tungsten E2 and it broke the first time I tried to plug it in.,negative
I could not recommend these more.,negative
Looks good in the picture but this case was a huge disappointment!!,negative
its extremely slow and takes forever to do anything with it.,negative
A must study for anyone interested in the worst sins of industrial design.,negative
The first thing that happened was that the tracking was off.,negative
Then I had to continue pairing it periodically since it somehow kept dropping.,negative
Can't upload ringtones from a third party.,negative
Bluetooth does not work phone locks up screens just flash up and now it just makes calls randomly while in my pocket locked.,negative
Truly awful.,negative
And none of the tones is acceptable.,negative
camera color balance is AWFUL.,negative
This product is clearly not ready for prime time I don't care how cool it looks if you can't tell a call is coming in it's worthless.,negative
Chinese Forgeries Abound!.,negative
The instructions didn't explain that a microphone jack could be used.,negative
i would advise to not purchase this item it never worked very well.,negative
Too bad you have to pay up to $$$ a month for the service!,negative
The nokia CA-42 USB cable did not work with my phone.,negative
The biggest complaint I have is the battery drains superfast.,negative
The design might be ergonomic in theory but I could not stand having these in my ear.,negative
Do NOT buy if you want to use the holster.,negative
It doesn't make you look cool.,negative
Also the phone doesn't seem to accept anything except CBR mp3s preferably ripped by Windows Media Player.,negative
So just beware.,negative
So anyone near you will hear part of your conversation.,negative
I bought this phone as a replacement for my StarTac and have regretted it since.,negative
Can't store anything but phone numbers to SIM.,negative
It lasts less than 3o minutes if I actually try to use the phone.My wife has the same phone with the same problem.,negative
Poor quality.,negative
Not worth it.,negative
The phone crashed completely and now I have to get it replaced.,negative
Unfortunately it will not recharge my iPhone 4s despite connecting it from multiple power sources (iMac external battery wall outlet etc).,negative
if you simply want a small flip phone -- look elsewhere as the extra bells & whistles are mediocre.,negative
Think it over when you plan to own this one!This sure is the last MOTO phone for me!,negative
After receiving and using the product for just 2 days it broke.,negative
None of the three sizes they sent with the headset would stay in my ears.,negative
We have tried 2 units and they both failed within 2 months.. Pros,negative
Couldn't use the unit with sunglasses not good in Texas!,negative
It dit not work most of the time with my Nokia 5320.,negative
Bought mainly for the charger which broke soon after purchasing.,negative
If you like a loud buzzing to override all your conversations then this phone is for you!,negative
stay away from this store be careful.,negative
Does not fit.,negative
disappointing.,negative
The camera on the phone may be used as a dustpan when indoors... I'd rather be using a disposable then this.,negative
Then a few days later the a puff of smoke came out of the phone while in use.,negative
The nano stated it.My son was dissapointed.,negative
Would not reccommend.,negative
This particular model would not work with my Motorola Q smartphone.,negative
wont work right or atleast for me.,negative
in addition it feels &amp looks as if the phone is all lightweight cheap plastic.,negative
But now that it is out of warranty the same problems reoccure.Bottom line... put your money somewhere else... Cingular will not support it.,negative
I really wanted the Plantronics 510 to be the right one but it has too many issues for me.The good,negative
AFter the first charge kept going dead after 12 minutes.,negative
VERY cheap plastic creaks like an old wooden floor.,negative
I get absolutely horrible reception in my apartment where with other phones I have not had this problem.,negative
After my phone got to be about a year old it's been slowly breaking despite much care on my part.,negative
I am sorry I made this purchase.,negative
I bought these hoping I could make my Bluetooth headset fit better but these things made it impossible to wear.,negative
