Treo and T-Mobile refused to replace it again and forced me to buy another phone without any kind of upgrade discount.,negative
It was horrible!.,negative
I don't think it would hold it too securly on your belt.,negative
This allows the possibility of double booking for the same date and time after the first.,negative
They work about 2 weeks then break.,negative
I can't use this case because the smell is disgusting.,negative
NOT WHAT I WANTED.,negative
The internet access was fine it the rare instance that it worked.,negative
$50 Down the drain.,negative
I tried talking real loud but shouting on the telephone gets old and I was still told it wasn't great.,negative
If there is a wind it is completely useless.,negative
Does Not Work.,negative
At first I thought I was grtting a good deal at $7.44 until I plugged it into my phone (V3c Razr).,negative
Improper description.... I had to return it.,negative
Battery has no life.,negative
I checked everywhere and there is no feature for it which is really disappointing.,negative
Doesn't do the job.,negative
Awkward to use and unreliable.,negative
Not as good as I had hoped.,negative
Doesn't Work.,negative
Unfortunately it did not work.,negative
All three broke within two months of use.,negative
dont buy it.,negative
My father has the V265 and the battery is dying.,negative
However the ear pads come off easily and after only one week I lost one.,negative
The calls drop the phone comes on and off at will the screen goes black and the worst of all it stops ringing intermittently.,negative
Horrible horrible protector.,negative
I don't like this Nokia either.,negative
Reaching for the bottom row is uncomfortable and the send and end keys are not where I expect them to be.3.,negative
I have bought this Nokia cell phone a few weeks ago and it was a nightmare.,negative
It would take too long to describe how bad my customer service experience has been with Amazon.,negative
the only VERY DISAPPOINTING thing was there was NO SPEAKERPHONE!!!!,negative
Terrible.. My car will not accept this cassette.,negative
Product is useless since it does not have enough charging current to charge the 2 cellphones I was planning to use it with.,negative
It's not what it says it is.,negative
Stay Away From the Q!.,negative
Used and dirty.,negative
Very unreliable service from T-mobile !,negative
Not good enough for the price.,negative
I bought two of them and neither will charge.,negative
These products cover up the important light sensor above the ear outlet.,negative
Just does not work.,negative
Poor Reliability.,negative
If I take a picture the battery drops a bar and starts beeping letting me know its dieing.,negative
Terrible product and waste of money!,negative
Last time buying from you.,negative
It was a waste of my money.,negative
The item received was Counterfeit.,negative
This is by far the worst purchase I've made on Amazon.,negative
Does not work for listening to music with the cingular 8125.,negative
The bottowm line...another worthless cheap gimmick from Sprint.,negative
Having trouble with volume.,negative
WARNING - DO NOT BUY!!.,negative
When it opens the battery connection is broken and the device is turned off.,negative
I didn't want the clip going over the top of my ear causing discomfort.,negative
Don't trust their website and don't expect any helpful support.,negative
The speaker is of low quality so as making the ring tones sound very cheap.,negative
Bad Reception.,negative
This product is very High quality Chinese CRAP!!!!!!,negative
Don't buy this product - It fails!.,negative
Everything about this product is wrong.First,negative
This was utterly confusing at first which caused me to lose a couple of very very important contacts.,negative
Terrible phone holder.,negative
Problem is that the ear loops are made of weak material and break easily.,negative
Not nearly as good looking as the AMAZON picture makes it look.,negative
How stupid is that?,negative
It always cuts out and makes a beep beep beep sound then says signal failed.,negative
Couldn't figure it out,negative
My phone sounded OK ( not great - OK) but my wife's phone was almost totally unintelligible she couldn't understand a word being said on it.,negative
So I had to take the battery out of the phone put it all back together and then restart it.,negative
While I managed to bend the leaf spring back in place the metal now has enough stress that it will break on the next drop.,negative
Saggy floppy piece of junk.,negative
It also had a new problem.,negative
It looses connection to the phone even when it is within a couple feet between the two.,negative
Makes it easier to keep up with my bluetooth when I'm not wearing it.,negative
As I said above....PRETTY USELESS!,negative
Never got it!!!!!,negative
This pair of headphones is the worst that I have ever had sound-wise.,negative
[...] down the drain because of a weak snap!,negative
Does not charge the Cingular (ATT) 8525 phone.,negative
However after about a year the fliptop started to get loose and wobbly and eventually my screen went black and I couldn't receive and place calls.,negative
I kept catching the cable on the seat and I had to pull the phone out to turn it on an off.,negative
The mic there is a joke and the volume is quite low.,negative
I'm returning them.,negative
I does not maintain a connection with the computer while it is on my lap.,negative
I had to purchase a different case.,negative
Very much disappointed with this company.,negative
It didn't charge for me.,negative
Buttons are too small.,negative
However the keypads are so tinny that I sometimes reach the wrong buttons.,negative
I cannot make calls at certain places.,negative
however my girl was complain that some time the phone doesn't wake up like normal phone does.,negative
This company charge me a restocking fee and still not given me my refund back.,negative
I'm trying to return it for a refund.,negative
I plugged it in only to find out not a darn thing worked.,negative
Earbud piece breaks easily.,negative
Lousy product.,negative
This phone tries very hard to do everything but fails at it's very ability to be a phone.,negative
Not enough volume.,negative
Echo Problem....Very unsatisfactory,negative
you could only take 2 videos at a time and the quality was very poor.,negative
don't waste your money.,negative
I am going to have to be the first to negatively review this product.,negative
Adapter does not provide enough charging current.,negative
There was so much hype over this phone that I assumed it was the best my mistake.,negative
You also cannot take pictures with it in the case because the lense is covered.,negative
Phone falls out easily.,negative
It didn't work people can not hear me when I talk.,negative
The text messaging feature is really tricky to use.,negative
I'm really disappointed all I have now is a charger that doesn't work.,negative
Painful on the ear.,negative
Lasted one day and then blew up.,negative
disappointed.,negative
Kind of flops around.,negative
The screen does get smudged easily because it touches your ear and face.,negative
What a piece of junk.. I lose more calls on this phone.,negative
Item Does Not Match Picture.,negative
The only thing that disappoint me is the infra red port (irda).,negative
You can not answer calls with the unit never worked once!,negative
Crust is not good.,negative
Not tasty and the texture was just nasty.,negative
Now I am getting angry and I want my damn pho.,negative
Honeslty it didn't taste THAT fresh.),negative
The potatoes were like rubber and you could tell they had been made up ahead of time being kept under a warmer.,negative
Would not go back.,negative
The cashier had no care what so ever on what I had to say it still ended up being wayyy overpriced.,negative
I was disgusted because I was pretty sure that was human hair.,negative
I was shocked because no signs indicate cash only.,negative
Waitress was a little slow in service.,negative
This place is not worth your time let alone Vegas.,negative
did not like at all.,negative
The Burrittos Blah!,negative
- They never brought a salad we asked for.,negative
Took an hour to get our food only 4 tables in restaurant my food was Luke warm Our sever was running around like he was totally overwhelmed.,negative
The worst was the salmon sashimi.,negative
This was like the final blow!,negative
seems like a good quick place to grab a bite of some familiar pub food but do yourself a favor and look elsewhere.,negative
Poor service the waiter made me feel like I was stupid every time he came to the table.,negative
Service sucks.,negative
There is not a deal good enough that would drag me into that establishment again.,negative
Hard to judge whether these sides were good because we were grossed out by the melted styrofoam and didn't want to eat it for fear of getting sick.,negative
Frozen pucks of disgust with some of the worst people behind the register.,negative
It's too bad the food is so damn generic.,negative
They have horrible attitudes towards customers and talk down to each one when customers don't enjoy their food.,negative
The Heart Attack Grill in downtown Vegas is an absolutely flat-lined excuse for a restaurant.,negative
Not much seafood and like 5 strings of pasta at the bottom.,negative
The ripped banana was not only ripped but petrified and tasteless.,negative
At least think to refill my water before I struggle to wave you over for 10 minutes.,negative
We got the food and apparently they have never heard of salt and the batter on the fish was chewy.,negative
The service was meh.,negative
It took over 30 min to get their milkshake which was nothing more than chocolate milk.,negative
I guess I should have known that this place would suck because it is inside of the Excalibur but I didn't use my common sense.,negative
The scallop dish is quite appalling for value as well.,negative
2 times - Very Bad Customer Service !,negative
There is so much good food in Vegas that I feel cheated for wasting an eating opportunity by going to Rice and Company.,negative
Coming here is like experiencing an underwhelming relationship where both parties can't wait for the other person to ask to break up.,negative
walked in and the place smelled like an old grease trap and only 2 others there eating.,negative
The turkey and roast beef were bland.,negative
The pan cakes everyone are raving about taste like a sugary disaster tailored to the palate of a six year old.,negative
The poor batter to meat ratio made the chicken tenders very unsatisfying.,negative
In summary this was a largely disappointing dining experience.,negative
Never been to Hard Rock Casino before WILL NEVER EVER STEP FORWARD IN IT AGAIN!,negative
say bye bye to your tip lady!,negative
We'll never go again.,negative
It was not good.,negative
REAL sushi lovers let's be honest - Yama is not that good.,negative
At least 40min passed in between us ordering and the food arriving and it wasn't that busy.,negative
It was pretty gross!,negative
I've had better atmosphere.,negative
Kind of hard to mess up a steak but they did.,negative
Although I very much liked the look and sound of this place the actual experience was a bit disappointing.,negative
I just don't know how this place managed to served the blandest food I have ever eaten when they are preparing Indian cuisine.,negative
Worst service to boot but that is the least of their worries.,negative
Host staff were for lack of a better word BITCHES!,negative
Bland... Not a liking this place for a number of reasons and I don't want to waste time on bad reviewing.. I'll leave it at that...,negative
I wouldn't return.,negative
This place is way too overpriced for mediocre food.,negative
The management is rude.,negative
He was extremely rude and really there are so many other restaurants I would love to dine at during a weekend in Vegas.,negative
Don't do it!!!!,negative
The waiter wasn't helpful or friendly and rarely checked on us.,negative
My husband and I ate lunch here and were very disappointed with the food and service.,negative
And the red curry had so much bamboo shoots and wasn't very tasty to me.,negative
The menu is always changing food quality is going down & service is extremely slow.,negative
The service was a little slow  considering that were served by 3 people servers so the food was coming in a slow pace.,negative
I give it 2 thumbs down,negative
We watched our waiter pay a lot more attention to other tables and ignore us.,negative
We waited for forty five minutes in vain.,negative
Crostini that came with the salad was stale.,negative
Unfortunately we must have hit the bakery on leftover day because everything we ordered was STALE.,negative
I came back today since they relocated and still not impressed.,negative
Avoid at all cost!,negative
So don't go there if you are looking for good food...,negative
I've never been treated so bad.,negative
We also ordered the spinach and avocado salad the ingredients were sad and the dressing literally had zero taste.,negative
Perhaps I caught them on an off night judging by the other reviews but I'm not inspired to go back.,negative
The service here leaves a lot to be desired.,negative
We literally sat there for 20 minutes with no one asking to take our order.,negative
The burger had absolutely no flavor - the meat itself was totally bland the burger was overcooked and there was no charcoal flavor.,negative
I also decided not to send it back because our waitress looked like she was on the verge of having a heart attack.,negative
I dressed up to be treated so rudely!,negative
It was probably dirt.,negative
The food sucked which we expected but it sucked more than we could have imagined.,negative
When my order arrived one of the gyros was missing.,negative
I'm not really sure how Joey's was voted best hot dog in the Valley by readers of Phoenix Magazine.,negative
The live music on Fridays totally blows.,negative
I've never been more insulted or felt disrespected.,negative
The warm beer didn't help.,negative
I've lived here since 1979 and this was the first (and last) time I've stepped foot into this place.,negative
The WORST EXPERIENCE EVER.,negative
Must have been an off night at this place.,negative
If that bug never showed up I would have given a 4 for sure but on the other side of the wall where this bug was climbing was the kitchen.,negative
For about 10 minutes we we're waiting for her salad when we realized that it wasn't coming any time soon.,negative
Won't go back.,negative
Soggy and not good.,negative
Which are small and not worth the price.,negative
The shower area is outside so you can only rinse not take a full shower unless you don't mind being nude for everyone to see!,negative
The service was a bit lacking.,negative
Lobster Bisque Bussell Sprouts Risotto Filet ALL needed salt and pepper..and of course there is none at the tables.,negative
Hopefully this bodes for them going out of business and someone who can cook can come in.,negative
It was either too cold not enough flavor or just bad.,negative
As for the mains also uninspired.,negative
If the food isn't bad enough for you then enjoy dealing with the world's worst/annoying drunk people.,negative
Ordered a double cheeseburger & got a single patty that was falling apart (picture uploaded) Yeah still sucks.,negative
If it were possible to give them zero stars they'd have it.,negative
The descriptions said yum yum sauce and another said eel sauce yet another said spicy mayo...well NONE of the rolls had sauces on them.,negative
If she had not rolled the eyes we may have stayed... Not sure if we will go back and try it again.,negative
Horrible - don't waste your time and money.,negative
By this time our side of the restaurant was almost empty so there was no excuse.,negative
(It wasn't busy either) Also the building was FREEZING cold.,negative
like the other reviewer said you couldn't pay me to eat at this place again.,negative
-Drinks took close to 30 minutes to come out at one point.,negative
Based on the sub-par service I received and no effort to show their gratitude for my business I won't be going back.,negative
There is nothing privileged about working/eating there.,negative
Overall I don't think that I would take my parents to this place again because they made most of the similar complaints that I silently felt too.,negative
I as well would've given godfathers zero stars if possible.,negative
very tough and very short on flavor!,negative
I have been in more than a few bars in Vegas and do not ever recall being charged for tap water.,negative
The service was not up to par either.,negative
For a self proclaimed coffee cafe I was wildly disappointed.,negative
I've had better not only from dedicated boba tea spots but even from Jenni Pho.,negative
I think not again,negative
I had the mac salad and it was pretty bland so I will not be getting that again.,negative
Service stinks here!,negative
I waited and waited.,negative
This place is not quality sushi it is not a quality restaurant.,negative
Things that went wrong: - They burned the saganaki.,negative
We waited an hour for what was a breakfast I could have done 100 times better at home.,negative
I hate to disagree with my fellow Yelpers but my husband and I were so disappointed with this place.,negative
Waited 2 hours & never got either of our pizzas as many other around us who came in later did!,negative
Just don't know why they were so slow.,negative
I live in the neighborhood so I am disappointed I won't be back here because it is a convenient location.,negative
Before I go in to why I gave a 1 star rating please know that this was my third time eating at Bachi burger before writing a review.,negative
Never again will I be dining at this place!,negative
Please stay away from the shrimp stir fried noodles.,negative
The potato chip order was sad... I could probably count how many chips were in that box and it was probably around 12.,negative
Food was really boring.,negative
This greedy corporation will NEVER see another dime from me!,negative
Will never ever go back.,negative
As much as I'd like to go back I can't get passed the atrocious service and will never return.,negative
She ordered a toasted English muffin that came out untoasted.,negative
Never going back.,negative
The bus boy on the other hand was so rude.,negative
By this point my friends and I had basically figured out this place was a joke and didn't mind making it publicly and loudly known.,negative
The only downside is the service.,negative
Also the fries are without a doubt the worst fries I've ever had.,negative
I go to far too many places and I've never seen any restaurant that serves a 1 egg breakfast especially for $4.00.,negative
When my mom and I got home she immediately got sick and she only had a few bites of salad.,negative
The servers are not pleasant to deal with and they don't always honor Pizza Hut coupons.,negative
Everything was gross.,negative
First - the bathrooms at this location were dirty- Seat covers were not replenished & just plain yucky!!!,negative
The burger... I got the Gold Standard a $17 burger and was kind of disappointed.,negative
There is nothing authentic about this place.,negative
the spaghetti is nothing special whatsoever.,negative
The selection was probably the worst I've seen in Vegas.....there was none.,negative
We sat another ten minutes and finally gave up and left.,negative
He was terrible!,negative
It shouldn't take 30 min for pancakes and eggs.,negative
Sadly Gordon Ramsey's Steak is a place we shall sharply avoid during our next trip to Vegas.,negative
The buffet is small and all the food they offered was BLAND.,negative
Definitely a turn off for me & i doubt I'll be back unless someone else is buying.,negative
I find wasting food to be despicable but this just wasn't food.,negative
My wife had the Lobster Bisque soup which was lukewarm.,negative
I left with a stomach ache and felt sick the rest of the day.,negative
They dropped more than the ball.,negative
And the beans and rice were mediocre at best.,negative
I took back my money and got outta there.,negative
RUDE & INCONSIDERATE MANAGEMENT.,negative
The staff are now not as friendly the wait times for being served are horrible no one even says hi for the first 10 minutes.,negative
I won't be back.,negative
The food was terrible.,negative
WILL NEVER EVER GO BACK AND HAVE TOLD MANY PEOPLE WHAT HAD HAPPENED.,negative
I don't recommend unless your car breaks down in front of it and you are starving.,negative
This place deserves one star and 90% has to do with the food.,negative
This is a disgrace.,negative
I'm probably one of the few people to ever go to Ians and not like it.,negative
This one is simply a disappointment.,negative
Overall I was very disappointed with the quality of food at Bouchon.,negative
I don't have to be an accountant to know I'm getting screwed!,negative
Left very frustrated.,negative
TOTAL WASTE OF TIME.,negative
For service I give them no stars.,negative
I can take a little bad service but the food sucks.,negative
Gave up trying to eat any of the crust (teeth still sore).,negative
But now I was completely grossed out.,negative
On the ground right next to our table was a large smeared been-stepped-in-and-tracked-everywhere pile of green bird poop.,negative
Furthermore you can't even find hours of operation on the website!,negative
We've tried to like this place but after 10+ times I think we're done with them.,negative
What a mistake that was!,negative
Waiter was a jerk.,negative
Strike 2 who wants to be rushed.,negative
I never come again.,negative
Ordered an appetizer and took 40 minutes and then the pizza another 10 minutes.,negative
It was a huge awkward 1.5lb piece of cow that was 3/4ths gristle and fat.,negative
I'll take my business dinner dollars elsewhere.,negative
Nothing special.,negative
Will not be back.,negative
Sauce was tasteless.,negative
I don't think we'll be going back anytime soon.,negative
I am far from a sushi connoisseur but I can definitely tell the difference between good food and bad food and this was certainly bad food.,negative
I was so insulted.,negative
The last 3 times I had lunch here has been bad.,negative
The chicken wings contained the driest chicken meat I have ever eaten.,negative
Definitely not worth the $3 I paid.,negative
The manager was the worst.,negative
I don't think I'll be running back to Carly's anytime soon for food.,negative
This is was due to the fact that it took 20 minutes to be acknowledged then another 35 minutes to get our food...and they kept forgetting things.,negative
The one down note is the ventilation could use some upgrading.,negative
Don't waste your time here.,negative
Total letdown I would much rather just go to the Camelback Flower Shop and Cartel Coffee.,negative
Third the cheese on my friend's burger was cold.,negative
We asked for the bill to leave without eating and they didn't bring that either.,negative
Seafood was limited to boiled shrimp and crab legs but the crab legs definitely did not taste fresh.,negative
The selection of food was not the best.,negative
I dont think I will be back for a very long time.,negative
It was attached to a gas station and that is rarely a good sign.,negative
Worse of all he humiliated his worker right in front of me..Bunch of horrible name callings.,negative
And then tragedy struck.,negative
I'd rather eat airline food seriously.,negative
I would not recommend this place.,negative
Overall I wasn't very impressed with Noca.,negative
My gyro was basically lettuce only.,negative
Terrible service!,negative
Thoroughly disappointed!,negative
it was a drive to get there.,negative
Anyway I do not think i will go back there.,negative
A greasy unhealthy meal.,negative
first time there and might just be the last.,negative
Similarly the delivery man did not say a word of apology when our food was 45 minutes late.,negative
And it was way to expensive.,negative
Terrible management.,negative
If there were zero stars I would give it zero stars.,negative
Worst martini ever!,negative
We waited for thirty minutes to be seated (although there were 8 vacant tables and we were the only folks waiting).,negative
I won't try going back there even if it's empty.,negative
No I'm going to eat the potato that I found some strangers hair in it.,negative
not even a hello we will be right with you.,negative
The desserts were a bit strange.,negative
I guess maybe we went on an off night but it was disgraceful.,negative
However my recent experience at this particular location was not so good.,negative
I know this is not like the other restaurants at all something is very off here!,negative
AVOID THIS ESTABLISHMENT!,negative
I think this restaurant suffers from not trying hard enough.,negative
My salad had a bland vinegrette on the baby greens and hearts of Palm.,negative
After two I felt disgusting.,negative
I will never go back to this place and will never ever recommended this place to anyone!,negative
The servers went back and forth several times not even so much as an Are you being helped?,negative
AN HOUR... seriously?,negative
I consider this theft.,negative
Eew... This location needs a complete overhaul.,negative
We recently witnessed her poor quality of management towards other guests as well.,negative
Waited and waited and waited.,negative
The pizza tasted old super chewy in not a good way.,negative
I swung in to give them a try but was deeply disappointed.,negative
Boy was that sucker dry!!.,negative
Over rated.,negative
If you look for authentic Thai food go else where.,negative
After I pulled up my car I waited for another 15 minutes before being acknowledged.,negative
I hate those things as much as cheap quality black olives.,negative
The kids play area is NASTY!,negative
It was extremely crumby and pretty tasteless.,negative
It was a pale color instead of nice and char and has NO flavor.,negative
